<?xml version="1.0" encoding="UTF-8"?>
<ConformanceContext UUID="389e0acf-69a6-46b1-9834-7581ee13a60f" xsi:noNamespaceSchemaLocation="../ConformanceContext.xsd" xmlns:xsi="http://www.w3.org/2001/XMLSchema-instance">
    <MetaData>
        <Description>Conformance context for ADT_A01</Description>
    </MetaData>
    <Predicates>
        <Datatype/>
        <Segment/>
        <Group/>
    </Predicates>
    <Constraints>
        <Datatype/>
        <Segment/>
        <Group/>
    </Constraints>
</ConformanceContext>
