<?xml version="1.0" encoding="UTF-8"?>
<ConformanceContext UUID="fbe4eb05-7382-4560-9fc6-665e52813be8" xsi:noNamespaceSchemaLocation="../ConformanceContext.xsd" xmlns:xsi="http://www.w3.org/2001/XMLSchema-instance">
    <MetaData>
        <Description>Conformance context for ADT_A03</Description>
    </MetaData>
    <Predicates>
        <Datatype/>
        <Segment/>
        <Group/>
    </Predicates>
    <Constraints>
        <Datatype/>
        <Segment/>
        <Group/>
    </Constraints>
</ConformanceContext>
